<mavenLauncher xmlns="http://vestige.googlecode.com/MAVEN_LAUNCHER" xmlns:xsi="http://www.w3.org/2001/XMLSchema-instance" xsi:schemaLocation="http://vestige.googlecode.com/MAVEN_LAUNCHER mavenLauncher.xsd">
  <attach version="${project.version}" groupId="com.googlecode.vestige" artifactId="vestige.jvm_enhancer" />
  <launch class="com.googlecode.vestige.edition.standard.StandardEditionVestige" groupId="com.googlecode.vestige" artifactId="vestige.edition.standard" version="${project.version}"
    mode="FIXED_DEPENDENCIES" />
  <config>
    <modifyDependency artifactId="milton-server-ce" groupId="io.milton">
      <addDependency artifactId="javax.servlet" groupId="org.eclipse.jetty.orbit" version="${javax-servlet.version}" />
    </modifyDependency>
    <modifyDependency artifactId="jetty-util" groupId="org.eclipse.jetty">
      <addDependency artifactId="slf4j-api" groupId="org.slf4j" version="${slf4j.version}" />
    </modifyDependency>
    <replaceDependency artifactId="logback-classic" groupId="ch.qos.logback">
      <exceptIn artifactId="slf4j-api" groupId="org.slf4j" />
      <addDependency artifactId="slf4j-api" groupId="org.slf4j" version="${slf4j.version}" />
    </replaceDependency>
    <modifyDependency artifactId="slf4j-api" groupId="org.slf4j">
      <addDependency artifactId="logback-classic" groupId="ch.qos.logback" version="${logback.version}" />
    </modifyDependency>
    <modifyDependency artifactId="aether-impl" groupId="org.eclipse.aether">
      <addDependency artifactId="vestige.resolver.maven" groupId="com.googlecode.vestige" version="${project.version}" />
    </modifyDependency>
    <replaceDependency artifactId="commons-logging" groupId="commons-logging">
      <addDependency artifactId="jcl-over-slf4j" groupId="org.slf4j" version="${slf4j.version}" />
    </replaceDependency>
    <fileAdditionalRepository id="vestige-repo" path="${vestige.mavenRepository}" />
  </config>
</mavenLauncher>
